No,Keyword,Search Intent,Search Volume,CPC,Paid Difficulty,SEO Difficulty
1,"how to use power automate",null,"1,600","$2.38","7","_"
2,"learn power automate",null,"720","$1.69","35","_"
3,"email automation with power automate",null,"0","$0.00","1","_"
4,"email automation workflow",null,"590","$17.53","30","_"
5,"email automation outlook",null,"480","$6.89","15","_"
6,"microsoft learn power automate training",null,"320","$0.00","1","_"
7,"learn power query",null,"320","$1.62","32","_"
8,"how to use microsoft power automate",null,"170","$1.95","9","_"
9,"how to share power automate desktop flow",null,"140","$0.00","1","_"
10,"how to automate power bi report",null,"140","$9.05","2","_"
11,"how to use power automate to send emails",null,"90","$0.00","3","_"
12,"how to install power automate desktop",null,"90","$0.00","2","_"
13,"how to use power automate to send emails from excel",null,"70","$0.00","1","_"
14,"how to schedule power automate desktop flow",null,"70","$0.00","1","_"
15,"learn power bi youtube",null,"70","$0.00","8","_"
16,"power automate take function",null,"50","$0.00","1","_"
17,"how to set up power automate",null,"50","$0.00","3","_"
18,"how to check power automate license",null,"50","$0.00","1","_"
19,"how to export power automate desktop flow",null,"50","$0.00","1","_"
20,"how to use power automate in power bi",null,"40","$0.00","5","_"
21,"how to share power automate desktop flow without premium",null,"40","$0.00","1","_"
22,"learn power fx",null,"40","$5.63","14","_"
23,"how to update power automate desktop",null,"30","$0.00","1","_"
24,"how to trigger power automate desktop flow automatically",null,"30","$0.00","3","_"
25,"how to change power automate language",null,"30","$0.00","1","_"
26,"how to automate power bi dashboard",null,"30","$3.03","17","_"
27,"learn power bi udemy",null,"30","$0.00","8","_"
28,"learn powershell 7",null,"30","$1.60","16","_"
29,"microsoft power automate explained",null,"20","$0.00","11","_"
30,"how to use graph api in power automate",null,"20","$0.00","1","_"
31,"how to use power automate with power bi",null,"20","$0.00","7","_"
32,"how to use odata filter query in power automate",null,"20","$0.00","2","_"
33,"how to automate power bi",null,"20","$0.00","8","_"
34,"how to use x2 power automatic battery charger",null,"20","$0.00","1","_"
35,"how to edit power automate code",null,"20","$0.00","1","_"
36,"how to automate power query",null,"20","$3.03","10","_"
37,"power automate system requirements",null,"20","$0.00","1","_"
38,"microsoft learn power automate certification",null,"20","$0.00","17","_"
39,"how to use power automate for approval",null,"10","$0.00","1","_"
40,"power automate settings",null,"10","$0.00","1","_"
41,"how to use run a prompt in power automate",null,"10","$0.00","1","_"
42,"how to use power automate in microsoft forms",null,"10","$0.00","2","_"
43,"how to automate power bi refresh",null,"10","$0.00","10","_"
44,"power automate time formats",null,"10","$0.00","1","_"
45,"learn microsoft com power automate",null,"10","$0.00","11","_"
46,"learn to automate everything with power query in excel",null,"10","$1.71","34","_"
47,"learn power apps free",null,"10","$0.00","28","_"
48,"email automation automation anywhere",null,"10","$0.00","1","_"
49,"email automation in outlook",null,"10","$0.00","18","_"
50,"how to use power automate to combine excel files",null,"0","$0.00","1","_"
51,"how to use power automate to extract data from pdf",null,"0","$0.00","1","_"
52,"how to use power automate with dynamics 365",null,"0","$0.00","1","_"
53,"how to use power automate in microsoft 365",null,"0","$0.00","1","_"
54,"how to use power automate in powerapps",null,"0","$0.00","1","_"
55,"how to use power automate templates",null,"0","$0.00","1","_"
56,"how to use power automate ai builder",null,"0","$0.00","1","_"
57,"how to use power automate ai",null,"0","$0.00","1","_"
58,"how to use power automate in business central",null,"0","$0.00","1","_"
59,"how to use microsoft power automate tutorial for beginners",null,"0","$0.00","1","_"
60,"how to automate power bi refresh and publish",null,"0","$0.00","1","_"
61,"how to use power automate chrome extension",null,"0","$0.00","1","_"
62,"how to use power automate excel",null,"0","$0.00","1","_"
63,"how to power automate emails",null,"0","$0.00","1","_"
64,"how to create power automate environment",null,"0","$0.00","1","_"
65,"how to use power automate for power bi",null,"0","$0.00","1","_"
66,"how to use power automate flow in powerapps",null,"0","$0.00","1","_"
67,"how to use power automate in forms",null,"0","$0.00","1","_"
68,"how to use power automate sharepoint",null,"0","$0.00","1","_"
69,"how to use power automate microsoft forms",null,"0","$0.00","1","_"
70,"how to power automate microsoft lists",null,"0","$0.00","1","_"
71,"how to use power automate on sharepoint",null,"0","$0.00","1","_"
72,"how to use power automate on teams",null,"0","$0.00","1","_"
73,"how to use power automate on excel",null,"0","$0.00","1","_"
74,"how to use power automate process mining",null,"0","$0.00","1","_"
75,"how to power automate sharepoint list",null,"0","$0.00","1","_"
76,"how to use power automate to update sharepoint list",null,"0","$0.00","1","_"
77,"how to use power automate with teams",null,"0","$0.00","1","_"
78,"how to use power automate with microsoft bookings",null,"0","$0.00","1","_"
79,"how to use power automate youtube",null,"0","$0.00","1","_"
80,"how to automate power query refresh in excel",null,"0","$0.00","1","_"
81,"how to transfer power automate ownership",null,"0","$0.00","1","_"
82,"how to use power automate in microsoft lists",null,"0","$0.00","1","_"
83,"how to automatic power off",null,"0","$0.00","1","_"
84,"how to use power bi to automate reports",null,"0","$0.00","1","_"
85,"how to use power automate free",null,"0","$0.00","1","_"
86,"how to use filter query in power automate get items",null,"0","$0.00","1","_"
87,"how to use power automate to send emails from outlook",null,"0","$0.00","1","_"
88,"how to change power automate owner",null,"0","$0.00","1","_"
89,"how to power automate service now",null,"0","$0.00","1","_"
90,"how to use power automate expressions",null,"0","$0.00","1","_"
91,"how to use power automate flow in copilot studio",null,"0","$0.00","1","_"
92,"how to download power automate on mac",null,"0","$0.00","1","_"
93,"how to use fetch xml in power automate",null,"0","$0.00","1","_"
94,"how to use copilot on power automate",null,"0","$0.00","1","_"
95,"how to use get attachment in power automate",null,"0","$0.00","1","_"
96,"how to edit power automate condition in advanced mode",null,"0","$0.00","1","_"
97,"how to use convert time zone in power automate",null,"0","$0.00","1","_"
98,"power automate how to use get file content",null,"0","$0.00","1","_"
99,"how to use xlsm in power automate",null,"0","$0.00","1","_"
100,"how to use search query in power automate",null,"0","$0.00","1","_"
101,"how to get power automate microsoft",null,"0","$0.00","1","_"
102,"how to use condition on power automate",null,"0","$0.00","1","_"
103,"how to import power automate desktop flow",null,"0","$0.00","1","_"
104,"how to install power automate gateway",null,"0","$0.00","1","_"
105,"how to use microsoft graph api in power automate",null,"0","$0.00","1","_"
106,"how to import power automate json",null,"0","$0.00","1","_"
107,"how to make power automate run faster",null,"0","$0.00","1","_"
108,"how to use power automate extension",null,"0","$0.00","1","_"
109,"how to use work queues in power automate",null,"0","$0.00","1","_"
110,"how to access power automate admin center",null,"0","$0.00","1","_"
111,"how to access power automate in office 365",null,"0","$0.00","1","_"
112,"how to use filter query in power automate for excel",null,"0","$0.00","1","_"
113,"how to use environment variables in power automate desktop",null,"0","$0.00","1","_"
114,"how to use update item in power automate",null,"0","$0.00","1","_"
115,"how to use api key in power automate",null,"0","$0.00","1","_"
116,"how to use power automate select action",null,"0","$0.00","1","_"
117,"how to use case in power automate",null,"0","$0.00","1","_"
118,"how to use power automate in azure devops",null,"0","$0.00","1","_"
119,"how to use power automate to send recurring emails",null,"0","$0.00","1","_"
120,"how to use get row in power automate",null,"0","$0.00","1","_"
121,"how to use parse json action in power automate",null,"0","$0.00","1","_"
122,"how to download power automate machine runtime",null,"0","$0.00","1","_"
123,"how easy is it to use power automate",null,"0","$0.00","1","_"
124,"how to use javascript in power automate",null,"0","$0.00","1","_"
125,"how to change power automate desktop language",null,"0","$0.00","1","_"
126,"how to view power automate code",null,"0","$0.00","1","_"
127,"how to use power query to automate excel",null,"0","$0.00","1","_"
128,"how to use power automate with a group form",null,"0","$0.00","1","_"
129,"how to use power automate copilot",null,"0","$0.00","1","_"
130,"how to use do until power automate",null,"0","$0.00","1","_"
131,"how to add power automate",null,"0","$0.00","1","_"
132,"how to use or in power automate",null,"0","$0.00","1","_"
133,"how to use power automate to send teams message",null,"0","$0.00","1","_"
134,"how to use xpath in power automate desktop",null,"0","$0.00","1","_"
135,"how to use automatic electric kettle",null,"0","$0.00","1","_"
136,"how to use list rows in power automate",null,"0","$0.00","1","_"
137,"how to use power automate in copilot studio",null,"0","$0.00","1","_"
138,"how to use get user profile v2 power automate",null,"0","$0.00","1","_"
139,"how to use power automate in microsoft planner",null,"0","$0.00","1","_"
140,"how to power automate sharepoint",null,"0","$0.00","1","_"
141,"how to use get items power automate",null,"0","$0.00","1","_"
142,"how to use initialize variable power automate",null,"0","$0.00","1","_"
143,"how to use power automate with loop",null,"0","$0.00","1","_"
144,"power automate what does apply to each do",null,"0","$0.00","1","_"
145,"how to use variables power automate",null,"0","$0.00","1","_"
146,"how to use array variable in power automate",null,"0","$0.00","1","_"
147,"how to use send keys in power automate desktop",null,"0","$0.00","1","_"
148,"how to use power query to automate",null,"0","$0.00","1","_"
149,"how to power reserve automatic watch",null,"0","$0.00","1","_"
150,"how to use power automate in 365",null,"0","$0.00","1","_"
151,"how to use join power automate",null,"0","$0.00","1","_"
152,"how to best use power automate",null,"0","$0.00","1","_"
153,"how to power automate mail merge",null,"0","$0.00","1","_"
154,"how to edit power automate code view",null,"0","$0.00","1","_"
155,"how to use power automate outlook",null,"0","$0.00","1","_"
156,"how to use azure key vault in power automate",null,"0","$0.00","1","_"
157,"how to use set variable in power automate",null,"0","$0.00","1","_"
158,"how to use variable in power automate expression",null,"0","$0.00","1","_"
159,"how to install power automate machine runtime",null,"0","$0.00","1","_"
160,"how to use contains in power automate filter query",null,"0","$0.00","1","_"
161,"how to use update row in power automate",null,"0","$0.00","1","_"
162,"how to power automate ms forms",null,"0","$0.00","1","_"
163,"how to use power automate select",null,"0","$0.00","1","_"
164,"how to use environment variables power automate",null,"0","$0.00","1","_"
165,"how to use switch on power automate",null,"0","$0.00","1","_"
166,"how to use power automate switch",null,"0","$0.00","1","_"
167,"how to use xpath power automate",null,"0","$0.00","1","_"
168,"how to use power bi automate",null,"0","$0.00","1","_"
169,"how to use apply to each power automate",null,"0","$0.00","1","_"
170,"how to use for each in power automate",null,"0","$0.00","1","_"
171,"how to automate power automate desktop flow",null,"0","$0.00","1","_"
172,"how to import power automate zip file",null,"0","$0.00","1","_"
173,"how to use power automate with azure devops",null,"0","$0.00","1","_"
174,"how to use power automate to save emails to sharepoint",null,"0","$0.00","1","_"
175,"how to use increment variable power automate",null,"0","$0.00","1","_"
176,"power automate how to use apply to each",null,"0","$0.00","1","_"
177,"how to power automate change new data",null,"0","$0.00","1","_"
178,"how to use expand query in power automate",null,"0","$0.00","1","_"
179,"how to use power automate in copilot",null,"0","$0.00","1","_"
180,"how to restore power automate version",null,"0","$0.00","1","_"
181,"how to use power automate in word",null,"0","$0.00","1","_"
182,"how to use power automate in onedrive",null,"0","$0.00","1","_"
183,"how to install power automate on desktop",null,"0","$0.00","1","_"
184,"how to use environment variables in power automate flow",null,"0","$0.00","1","_"
185,"how to use power automate cloud flow",null,"0","$0.00","1","_"
186,"how to use power automate to create tasks in planner",null,"0","$0.00","1","_"
187,"how to access power automate outlook",null,"0","$0.00","1","_"
188,"how to use key vault in power automate",null,"0","$0.00","1","_"
189,"how to use xx2 power automatic battery charger",null,"0","$0.00","1","_"
190,"how to use work queues in power automate desktop",null,"0","$0.00","1","_"
191,"how to use oauth 2.0 in power automate",null,"0","$0.00","1","_"
192,"how to use json in power automate",null,"0","$0.00","1","_"
193,"how to use power automate approvals",null,"0","$0.00","1","_"
194,"how to use power automate on desktop",null,"0","$0.00","1","_"
195,"how to schedule power automate desktop flow without premium",null,"0","$0.00","1","_"
196,"how to use power automate to refresh data in excel",null,"0","$0.00","1","_"
197,"how to use azure key vault in power automate desktop",null,"0","$0.00","1","_"
198,"how to use power automate to compare two excel files",null,"0","$0.00","1","_"
199,"how to power automate desktop",null,"0","$0.00","1","_"
200,"how to use append to array variable in power automate",null,"0","$0.00","1","_"
201,"how to use power automate to send automatic emails",null,"0","$0.00","1","_"
202,"learn power automate youtube",null,"0","$0.00","1","_"
203,"learning microsoft power automate o'reilly",null,"0","$0.00","1","_"
204,"learn power bi and power automate",null,"0","$0.00","1","_"
205,"power automate apply to each example",null,"0","$0.00","1","_"
206,"is power automate good to learn",null,"0","$0.00","1","_"
207,"learning microsoft power automate pdf download",null,"0","$0.00","1","_"
208,"power automate rpa learn",null,"0","$0.00","1","_"
209,"learning microsoft power automate by paul papanek stork",null,"0","$0.00","1","_"
210,"learning microsoft power automate by paul papanek stork pdf",null,"0","$0.00","1","_"
211,"linkedin learning power automate course",null,"0","$0.00","1","_"
212,"power automate easy to learn",null,"0","$0.00","1","_"
213,"learn pl 500 power automate rpa developer associate",null,"0","$0.00","1","_"
214,"microsoft learn power automate modules",null,"0","$0.00","1","_"
215,"microsoft learn power automate in a day",null,"0","$0.00","1","_"
216,"https learn microsoft com power automate desktop flows install",null,"0","$0.00","1","_"
217,"learn power automate basics",null,"0","$0.00","1","_"
218,"microsoft learn power automate flow",null,"0","$0.00","1","_"
219,"learn json for power automate",null,"0","$0.00","1","_"
220,"where can i learn power automate",null,"0","$0.00","1","_"
221,"is power automate difficult to learn",null,"0","$0.00","1","_"
222,"microsoft learn power automate documentation",null,"0","$0.00","1","_"
223,"power automate learn documentation",null,"0","$0.00","1","_"
224,"microsoft learn power automate cloud",null,"0","$0.00","1","_"
225,"microsoft learn power automate connectors",null,"0","$0.00","1","_"
226,"fastest way to learn power automate",null,"0","$0.00","1","_"
227,"learning microsoft power automate paul papanek stork",null,"0","$0.00","1","_"
228,"learn about power automate",null,"0","$0.00","1","_"
229,"learn more about power automate",null,"0","$0.00","1","_"
230,"is power automate hard to learn reddit",null,"0","$0.00","1","_"
231,"learn power query reddit",null,"0","$0.00","1","_"
232,"power automate is easy to learn",null,"0","$0.00","1","_"
233,"learn excel power query to automate boring tasks",null,"0","$0.00","1","_"
234,"microsoft learn power automate learning path",null,"0","$0.00","1","_"
235,"microsoft learn power automate ai builder",null,"0","$0.00","1","_"
236,"microsoft learn power automate rpa",null,"0","$0.00","1","_"
237,"microsoft learn power automate fundamentals",null,"0","$0.00","1","_"
238,"microsoft learn power automate basics",null,"0","$0.00","1","_"
239,"power automate hard to learn",null,"0","$0.00","1","_"
240,"learn microsoft power fx",null,"0","$0.00","1","_"
241,"power automate on microsoft learn",null,"0","$0.00","1","_"
242,"best site to learn power automate",null,"0","$0.00","1","_"
243,"power automate premium learn",null,"0","$0.00","1","_"
244,"is power automate easy to learn reddit",null,"0","$0.00","1","_"
245,"how can i learn power automate",null,"0","$0.00","1","_"
246,"microsoft learn power automate expressions",null,"0","$0.00","1","_"
247,"power automate minimum requirements",null,"0","$0.00","1","_"
248,"best platform to learn power automate",null,"0","$0.00","1","_"
249,"microsoft power automate learn power automate desktop & web",null,"0","$0.00","1","_"
250,"learning power automate desktop for non developers",null,"0","$0.00","1","_"
251,"microsoft learn power automate process mining",null,"0","$0.00","1","_"
252,"how do i learn power automate",null,"0","$0.00","1","_"
253,"beginner power automate",null,"0","$0.00","1","_"
254,"learn power automate step by step with real time projects",null,"0","$0.00","1","_"
255,"learn power automate quickly",null,"0","$0.00","1","_"
256,"learning microsoft power automate book",null,"0","$0.00","1","_"
257,"microsoft learn power automate course",null,"0","$0.00","1","_"
258,"power automate learn path",null,"0","$0.00","1","_"
259,"email automation power automate",null,"0","$0.00","1","_"
260,"email automation using power automate",null,"0","$0.00","1","_"
